{
  "$schema": "https://godpowers.dev/schema/state.v1.json",
  "version": "1.0.0",
  "project": {
    "name": "quick-proof-saas",
    "started": "2026-05-16T00:00:00.000Z"
  },
  "active-workstream": "main",
  "tiers": {
    "tier-0": {
      "orchestration": {
        "status": "done",
        "updated": "2026-05-16T00:00:00.000Z"
      }
    },
    "tier-1": {
      "prd": {
        "status": "pending"
      },
      "arch": {
        "status": "pending"
      },
      "roadmap": {
        "status": "pending"
      },
      "stack": {
        "status": "pending"
      },
      "design": {
        "status": "not-required",
        "reason": "Fixture is focused on state and routing proof."
      },
      "product": {
        "status": "not-required",
        "reason": "Fixture is focused on state and routing proof."
      }
    },
    "tier-2": {
      "repo": {
        "status": "pending"
      },
      "build": {
        "status": "pending"
      }
    },
    "tier-3": {
      "deploy": {
        "status": "pending"
      },
      "observe": {
        "status": "pending"
      },
      "launch": {
        "status": "pending"
      },
      "harden": {
        "status": "pending"
      }
    }
  },
  "lifecycle-phase": "in-arc",
  "linkage": {
    "coverage-pct": 0,
    "orphan-count": 0,
    "drift-count": 0,
    "review-required-items": 0
  },
  "yolo-decisions": []
}
